[
  {
    "requirement_id": "EXTREQ-20649D4DCA588179",
    "identity_key": "scientific-domain-taxonomy",
    "vigil_source_id": "EXT-477888AB2C1E",
    "external_source_id": "C2PA-SPEC",
    "source_version": "2.4",
    "canonical_source_identifier": {
      "scheme": "C2PA",
      "value": "C2PA Technical Specification 2.4"
    },
    "issuer": "Coalition for Content Provenance and Authenticity",
    "jurisdiction": "International",
    "source_class": "technical-specification",
    "source_lifecycle_state": "published",
    "source_role": "primary-ai-governance",
    "authoritative_locator": "https://spec.c2pa.org/specifications/specifications/2.4/index.html",
    "clause_or_control": "Section 18.28.2",
    "parent_section_or_group": "Section 18.28.2",
    "source_access_status": "direct-public-primary",
    "source_review_date": "2026-10-01",
    "source_access_notes": "Direct review of authoritative HTML bytes. Accessed 2026-10-01.",
    "requirement_summary": "If scientificDomain is included, its value must conform to the arXiv taxonomy.",
    "requirement_posture": "mandatory-normative",
    "expectation_type": "positive-duty",
    "normative_force": "voluntary-technical-specification",
    "alignment_relationship": "conformance",
    "applicable_actor": [
      "C2PA claim generators"
    ],
    "governed_object": [
      "C2PA 2.4 manifests, claims and assertions"
    ],
    "lifecycle_stage": [
      "development",
      "operation-use"
    ],
    "governance_expectation": "If scientificDomain is included, its value must conform to the arXiv taxonomy.",
    "evidence_expectation": [],
    "timing_or_frequency": [],
    "required_artefacts": [],
    "verification_method": [],
    "applicability_conditions": [
      "Applies when implementing the cited C2PA 2.4 construct or procedure; does not require universal adoption of C2PA.",
      "The optional scientificDomain field is supplied."
    ],
    "exceptions_or_qualifications": [
      "Technical conformance is distinct from legal compliance.",
      "Cryptographically valid provenance does not establish factual truth, content quality, or that a recorded human review actually occurred.",
      "This is a format requirement, not verification that the subject was classified correctly."
    ],
    "governance_concepts": [
      "conformity",
      "transparency"
    ],
    "source_defined_tags": [],
    "semantic_atomicity": "atomic",
    "related_external_requirements": [],
    "interpretation_status": "needs-specialist-review",
    "interpretation_provenance": {
      "basis": "direct-primary-text",
      "content_origin": "ai-authored",
      "generated_by": "ai",
      "generation_mode": "semi-autonomous",
      "human_role": "contract-approver",
      "human_authorship": false,
      "human_review_status": "not-reviewed",
      "human_verification_status": "not-verified",
      "source_analysis_method": "AI review of the cited primary-text proposition, separating independently assessable actions and preserving actor, modality, applicability, timing and qualifications. No Fidelity Class relationship or Incident finding was created.",
      "source_locator": "https://spec.c2pa.org/specifications/specifications/2.4/specs/C2PA_Specification.html#_details_2",
      "source_metadata_fingerprint": "8356be4cea097d91af9b09b7a446d342f23bb4bf24e209fc9c17d2b37ef0f745",
      "reviewed_source_digest": "d55caebd96206f0de667962a4bab7098c6b6468fba68f8b55bcdd3a12d1ed26d",
      "reviewed_source_digest_algorithm": "sha256",
      "reviewed_source_digest_status": "recorded"
    },
    "assurance_provenance": [],
    "review_limitations": [
      "No substantive human review or source verification.",
      "Section 18.28.2 prose constrains modelType to Table 12, while the CDDL permits tstr. The scientificDomain CDDL uses a list/sequence but the example supplies a scalar. Retain the prose rule; specialist resolution is required before treating schema validation as sufficient conformance evidence."
    ]
  },
  {
    "requirement_id": "EXTREQ-2C8D94B209C2F80D",
    "identity_key": "preserve-update-hard-binding",
    "vigil_source_id": "EXT-477888AB2C1E",
    "external_source_id": "C2PA-SPEC",
    "source_version": "2.4",
    "canonical_source_identifier": {
      "scheme": "C2PA",
      "value": "C2PA Technical Specification 2.4"
    },
    "issuer": "Coalition for Content Provenance and Authenticity",
    "jurisdiction": "International",
    "source_class": "technical-specification",
    "source_lifecycle_state": "published",
    "source_role": "primary-ai-governance",
    "authoritative_locator": "https://spec.c2pa.org/specifications/specifications/2.4/index.html",
    "clause_or_control": "Section 6.8",
    "parent_section_or_group": "Section 6.8",
    "source_access_status": "direct-public-primary",
    "source_review_date": "2026-10-01",
    "source_access_notes": "Direct review of authoritative HTML bytes. Accessed 2026-10-01.",
    "requirement_summary": "When creating an update manifest, claim generators must not redact the hard-binding assertion applying to the current asset.",
    "requirement_posture": "mandatory-normative",
    "expectation_type": "prohibition",
    "normative_force": "voluntary-technical-specification",
    "alignment_relationship": "conformance",
    "applicable_actor": [
      "C2PA claim generators"
    ],
    "governed_object": [
      "C2PA 2.4 manifests, claims and assertions"
    ],
    "lifecycle_stage": [
      "development",
      "operation-use"
    ],
    "governance_expectation": "When creating an update manifest, claim generators must not redact the hard-binding assertion applying to the current asset.",
    "evidence_expectation": [],
    "timing_or_frequency": [],
    "required_artefacts": [],
    "verification_method": [],
    "applicability_conditions": [
      "Applies when implementing the cited C2PA 2.4 construct or procedure; does not require universal adoption of C2PA.",
      "An update manifest is being created."
    ],
    "exceptions_or_qualifications": [
      "Technical conformance is distinct from legal compliance.",
      "Cryptographically valid provenance does not establish factual truth, content quality, or that a recorded human review actually occurred."
    ],
    "governance_concepts": [
      "provenance",
      "security"
    ],
    "source_defined_tags": [],
    "semantic_atomicity": "atomic",
    "related_external_requirements": [],
    "interpretation_status": "reviewed-analytical-summary",
    "interpretation_provenance": {
      "basis": "direct-primary-text",
      "content_origin": "ai-authored",
      "generated_by": "ai",
      "generation_mode": "semi-autonomous",
      "human_role": "contract-approver",
      "human_authorship": false,
      "human_review_status": "not-reviewed",
      "human_verification_status": "not-verified",
      "source_analysis_method": "AI review of the cited primary-text proposition, separating independently assessable actions and preserving actor, modality, applicability, timing and qualifications. No Fidelity Class relationship or Incident finding was created.",
      "source_locator": "https://spec.c2pa.org/specifications/specifications/2.4/specs/C2PA_Specification.html#_redaction_of_assertions",
      "source_metadata_fingerprint": "8356be4cea097d91af9b09b7a446d342f23bb4bf24e209fc9c17d2b37ef0f745",
      "reviewed_source_digest": "d55caebd96206f0de667962a4bab7098c6b6468fba68f8b55bcdd3a12d1ed26d",
      "reviewed_source_digest_algorithm": "sha256",
      "reviewed_source_digest_status": "recorded"
    },
    "assurance_provenance": [],
    "review_limitations": [
      "No substantive human review or source verification."
    ]
  },
  {
    "requirement_id": "EXTREQ-2ED6764450B3203F",
    "identity_key": "local-assertion-store",
    "vigil_source_id": "EXT-477888AB2C1E",
    "external_source_id": "C2PA-SPEC",
    "source_version": "2.4",
    "canonical_source_identifier": {
      "scheme": "C2PA",
      "value": "C2PA Technical Specification 2.4"
    },
    "issuer": "Coalition for Content Provenance and Authenticity",
    "jurisdiction": "International",
    "source_class": "technical-specification",
    "source_lifecycle_state": "published",
    "source_role": "primary-ai-governance",
    "authoritative_locator": "https://spec.c2pa.org/specifications/specifications/2.4/index.html",
    "clause_or_control": "Section 6.6",
    "parent_section_or_group": "Section 6.6",
    "source_access_status": "direct-public-primary",
    "source_review_date": "2026-10-01",
    "source_access_notes": "Direct review of authoritative HTML bytes. Accessed 2026-10-01.",
    "requirement_summary": "Every assertion referenced by created_assertions or gathered_assertions must be present in the assertion store of the same manifest, using the Section 11.1 storage form.",
    "requirement_posture": "mandatory-normative",
    "expectation_type": "positive-duty",
    "normative_force": "voluntary-technical-specification",
    "alignment_relationship": "conformance",
    "applicable_actor": [
      "C2PA claim generators"
    ],
    "governed_object": [
      "C2PA 2.4 manifests, claims and assertions"
    ],
    "lifecycle_stage": [
      "development",
      "operation-use"
    ],
    "governance_expectation": "Every assertion referenced by created_assertions or gathered_assertions must be present in the assertion store of the same manifest, using the Section 11.1 storage form.",
    "evidence_expectation": [],
    "timing_or_frequency": [],
    "required_artefacts": [
      "Assertion store in the claim's C2PA Manifest."
    ],
    "verification_method": [],
    "applicability_conditions": [
      "Applies when implementing the cited C2PA 2.4 construct or procedure; does not require universal adoption of C2PA.",
      "Excludes redacted_assertions references."
    ],
    "exceptions_or_qualifications": [
      "Technical conformance is distinct from legal compliance.",